{
  "record_id": "f16-diagnostic-ai-subgroup-performance-detailed-v1",
  "case_id": "f16-diagnostic-ai-subgroup-performance",
  "version": "1.0.0",
  "title": "Diagnostic AI with unequal subgroup performance",
  "short_description": "A diagnostic AI improves overall accuracy but has a materially higher false-negative rate in one minority subgroup. The health system must decide whether and how to deploy it.",
  "decision_question": "Should a health system deploy a diagnostic AI that has high overall accuracy but materially worse performance for one subgroup, and what threshold or safeguards should govern deployment?",
  "representation": {
    "form": "detailed",
    "companion_record_ids": [
      "f16-diagnostic-ai-subgroup-performance-concise-v1"
    ],
    "notes": "Concise and detailed are companion representations of one case family. They share the decision question and the executable candidate set exactly; only scenario detail differs. Neither is the correct or superior representation of the case."
  },
  "benchmark_profile": "featured-core-2x2x2-v1",
  "jurisdiction_context": null,
  "as_of_date": "2026-08-26",
  "domains": [
    "medical-ai-data"
  ],
  "tags": [
    "algorithmic fairness",
    "subgroup validation",
    "clinical deployment",
    "human oversight",
    "monitoring"
  ],
  "scenario": "A health system is considering a diagnostic AI that has been externally validated and improves overall sensitivity and workflow compared with current practice. Performance is not equal across groups: in one minority subgroup, the false-negative rate is materially higher than in the majority group, although it remains similar to or slightly better than current unaided practice. Retraining may reduce the disparity but would delay deployment, and the size of the subgroup means additional validation data will take time to collect. Patients would not interact directly with the model; clinicians would receive its recommendation and could override it. Public and patient studies consistently raise concerns about discrimination, explainability, and retaining human responsibility in medical AI. The health system must decide whether the current benefit justifies deployment and what subgroup threshold, fallback, monitoring, and disclosure rules should apply.",
  "scenario_provenance": {
    "construction_method": "adapted-from-source",
    "summary": "Independently constructed Bench representation of the case family, written for this record from the source material listed here. No casebook or article prose is reproduced. The detailed representation unpacks facts, uncertainty, stakeholders and institutional authority already implicit in the concise companion. It adds no morally decisive fact and does not change the decision being represented.",
    "sources": [
      {
        "citation": "World Health Organization, Ethics and Governance of Artificial Intelligence for Health: WHO Guidance (Geneva: WHO, 2021).",
        "type": "guideline",
        "url": "https://www.who.int/publications/i/item/9789240029200"
      },
      {
        "citation": "Literature on subgroup validation, performance disparity and post-deployment monitoring for clinical machine-learning systems.",
        "type": "article"
      }
    ],
    "adapted_not_reproduced": true
  },
  "candidate_pools": {
    "public": [
      {
        "id": "pub1",
        "text": "Do not deploy the AI until its false-negative rate for the worse-performing subgroup meets the same minimum safety threshold required for the overall population.",
        "source_pool": "public",
        "provenance": {
          "construction_method": "adapted-from-source",
          "summary": "Adapted from patient and public studies of medical AI in which discrimination and unequal performance are among the most persistent concerns, and from work with minority patient groups on unequal datasets. The equal-threshold rule is Bench editorial translation of that concern into a deployment condition.",
          "sources": [
            {
              "citation": "Patient and public studies of medical AI reporting persistent concerns about discrimination and bias, explainability, privacy, and retaining clinician responsibility, including work with minority patient groups on unequal datasets and subgroup performance.",
              "type": "survey"
            }
          ]
        }
      },
      {
        "id": "pub2",
        "text": "Deploy only with clear clinician review and an automatic fallback pathway for patients in the worse-performing subgroup until additional validation and retraining reduce the disparity.",
        "source_pool": "public",
        "provenance": {
          "construction_method": "adapted-from-source",
          "summary": "Adapted from the same studies, in which retaining human clinical responsibility and explainability are emphasized alongside fairness. The clinician-review and fallback mechanism is Bench editorial translation of that emphasis.",
          "sources": [
            {
              "citation": "Patient and public studies of medical AI reporting persistent concerns about discrimination and bias, explainability, privacy, and retaining clinician responsibility, including work with minority patient groups on unequal datasets and subgroup performance.",
              "type": "survey"
            }
          ]
        }
      }
    ],
    "expert": [
      {
        "id": "exp1",
        "text": "Use subgroup-specific validation thresholds before deployment and require ongoing performance monitoring, human oversight, incident review, and a remediation plan for material disparities.",
        "source_pool": "expert",
        "provenance": {
          "construction_method": "adapted-from-source",
          "summary": "Adapted from WHO guidance on the ethics and governance of AI for health and on large multi-modal models, together with the subgroup-validation literature, which call for disaggregated validation, human oversight and post-deployment monitoring.",
          "sources": [
            {
              "citation": "World Health Organization, Ethics and Governance of Artificial Intelligence for Health: WHO Guidance (Geneva: WHO, 2021).",
              "type": "guideline",
              "url": "https://www.who.int/publications/i/item/9789240029200"
            },
            {
              "citation": "World Health Organization, Ethics and Governance of Artificial Intelligence for Health: Guidance on Large Multi-Modal Models (Geneva: WHO, 2024).",
              "type": "guideline",
              "url": "https://www.who.int/publications/i/item/9789240084759"
            },
            {
              "citation": "Literature on subgroup validation, performance disparity and post-deployment monitoring for clinical machine-learning systems.",
              "type": "article"
            }
          ]
        }
      },
      {
        "id": "exp2",
        "text": "Deploy when the tool improves outcomes over the actual local baseline for every subgroup, but document residual disparities and use risk-based safeguards rather than requiring identical error rates.",
        "source_pool": "expert",
        "provenance": {
          "construction_method": "adapted-from-source",
          "summary": "Adapted from the same governance guidance and fairness literature, which evaluate a system against the care it actually replaces and prescribe proportionate risk-based safeguards rather than parity of error rates as a deployment precondition.",
          "sources": [
            {
              "citation": "World Health Organization, Ethics and Governance of Artificial Intelligence for Health: WHO Guidance (Geneva: WHO, 2021).",
              "type": "guideline",
              "url": "https://www.who.int/publications/i/item/9789240029200"
            },
            {
              "citation": "Literature on subgroup validation, performance disparity and post-deployment monitoring for clinical machine-learning systems.",
              "type": "article"
            }
          ]
        }
      }
    ],
    "framework": [
      {
        "id": "fw1",
        "text": "Do not impose a higher avoidable diagnostic risk on a historically disadvantaged group merely because aggregate performance is strong; fair deployment requires a defensible minimum level for each group.",
        "source_pool": "framework",
        "provenance": {
          "construction_method": "derived-from-framework",
          "summary": "Derived from equal protection and anti-discrimination reasoning: the reasoning bridge is that an aggregate gain distributed so that an already disadvantaged group bears the residual risk is a distributive wrong the aggregate cannot answer, so a per-group floor is required. The policy sentence is a Bench construction.",
          "sources": [
            {
              "citation": "John Rawls, A Theory of Justice, revised ed. (Harvard University Press, 1999).",
              "type": "book"
            },
            {
              "citation": "Tom L. Beauchamp and James F. Childress, Principles of Biomedical Ethics, 8th ed. (Oxford University Press, 2019).",
              "type": "book"
            }
          ]
        }
      },
      {
        "id": "fw2",
        "text": "Deploy if doing so improves expected health outcomes for each affected group and no feasible alternative creates greater total benefit, while investing in correction of residual inequity.",
        "source_pool": "framework",
        "provenance": {
          "construction_method": "derived-from-framework",
          "summary": "Derived from a Pareto-constrained consequentialist rule: the reasoning bridge is that withholding a tool that improves every group’s outcomes relative to the real baseline harms the very group the objection is meant to protect, so the remaining duty is corrective investment. The policy sentence is a Bench construction.",
          "sources": [